nombre,descripcion,tipo_presentacion,tipo_medida
Vetramil,"El componente activo de Vetramil Pomada es la miel, que aporta una alta concentracion de azucares que ayudan a prevenir la sequedad de la piel. Los excipientes suavizan la piel y la protegen de la descamacion y los aceites esenciales contribuyen a mantener las propiedades fisiologicas de la piel.",Pomada,gr
prueba,probando funcionalidad xd,Jarabe,ml
prueba2,Medicina de prueba.,Pastilla,gr
Cefovecina sódica,"Se trata de un medicamento inyectable de acción prolongada. Esto quiere decir que con un solo pinchazo su efecto perdura durante 14 días. Es especialmente cómodo para gatos y, además, es de amplio espectro por lo que lucha contra un amplio rango de bacterias.",Solucion Inyectable,ml
Doxicilina,"Es de amplio espectro, y especialmente útil en el caso de los parásitos sanguíneos, como por ejemplo el Mycoplasma.",Jarabe,ml
Amoxicilina,"Este antibiótico para gatos combate una gran cantidad de bacterias, lo que lo convierte en uno de los más utilizados. Puedes encontrarlo en presentación de jarabe para gatos pequeños y en comprimidos de pequeño tamaño para gatos adultos. En el caso de los gatos más jóvenes, la amoxicilina está especialmente indicada pues otros antibióticos podrían afectar a los cartílagos de crecimiento.",Pastillas,gr
